{
  "$schema": "https://json-schema.org/draft/2020-12/schema",
  "$id": "https://tura.ai/schemas/benchmark/benchmark-web-run.schema.json",
  "title": "Normalized benchmark web run",
  "description": "Primary benchmark-web-run.json contract consumed by CI. It contains the complete prompt, run totals, display rounds, harness evidence, diff summary, and grouped metadata.",
  "type": "object",
  "properties": {
    "schema": {
      "type": "string",
      "enum": ["tura.benchmark.web-run.v1", "tura.benchmark.run.v1"],
      "description": "Contract discriminator. run.v1 is the original rewrite contract; web-run.v1 is the normalized debug contract."
    },
    "id": {
      "type": "string",
      "minLength": 1,
      "description": "Canonical run ID."
    },
    "task": { "type": "string", "minLength": 1, "description": "Task ID." },
    "agent": {
      "type": "string",
      "minLength": 1,
      "description": "Canonical public agent ID including model and effort."
    },
    "taskName": {
      "type": "string",
      "description": "Task title or stable task label."
    },
    "sessionName": {
      "type": "string",
      "description": "Run/session name. Current normalized data uses the same value as id."
    },
    "title": {
      "type": "string",
      "description": "Run title shown on the run page; it identifies the run, not only the task."
    },
    "subtitle": {
      "type": "string",
      "description": "Short factual run description."
    },
    "prompt": {
      "type": "object",
      "description": "Task-starting user prompt. The website treats this as user information.",
      "properties": {
        "text": {
          "type": "string",
          "description": "Complete prompt with Markdown and line breaks preserved."
        },
        "sourcePath": {
          "type": "string",
          "description": "Optional relative artifact path for the prompt."
        }
      },
      "required": ["text"],
      "additionalProperties": true
    },
    "source": {
      "type": "object",
      "description": "Run-level metrics and pricing calculated before website generation.",
      "properties": {
        "url": {
          "type": "string",
          "description": "Source repository or benchmark artifact URL."
        },
        "model": {
          "type": "string",
          "description": "Real model used by the run."
        },
        "steps": {
          "type": "integer",
          "minimum": 0,
          "description": "Agent round/step count used by run summary UI."
        },
        "costUsd": {
          "type": ["number", "null"],
          "minimum": 0,
          "description": "Total run cost in USD, or null when provider usage was not recovered."
        },
        "pricing": {
          "type": ["object", "null"],
          "description": "Pricing audit record containing rates, billable token categories, source URL, tier, and context band.",
          "properties": {
            "costUsd": {
              "type": "number",
              "minimum": 0,
              "description": "Calculated USD cost; must match source.costUsd within rounding precision."
            },
            "currency": {
              "type": "string",
              "description": "Currency code, normally USD."
            },
            "source": {
              "type": "string",
              "description": "Authoritative pricing source URL or versioned mapping ID."
            },
            "model": {
              "type": "string",
              "description": "Normalized model matched by the pricing table."
            },
            "requestedModel": {
              "type": "string",
              "description": "Model name requested by the run before pricing normalization."
            },
            "tier": {
              "type": "string",
              "description": "API service tier used by the price mapping."
            },
            "context": {
              "type": "string",
              "description": "Context pricing band such as short or long."
            },
            "unit": {
              "type": "string",
              "description": "Rate unit, normally 1M tokens."
            },
            "ratesPer1M": {
              "type": "object",
              "description": "Input, cached-input, and output USD rates per one million tokens.",
              "additionalProperties": { "type": "number", "minimum": 0 }
            },
            "billableTokens": {
              "type": "object",
              "description": "Pricing token categories. Names follow the pricing tool output and represent input/cachedInput/output/reasoning/total.",
              "properties": {
                "input": {
                  "type": "integer",
                  "minimum": 0,
                  "description": "Billable non-cached input tokens."
                },
                "cachedInput": {
                  "type": "integer",
                  "minimum": 0,
                  "description": "Billable cached input tokens."
                },
                "output": {
                  "type": "integer",
                  "minimum": 0,
                  "description": "Billable output tokens."
                },
                "reasoning": {
                  "type": "integer",
                  "minimum": 0,
                  "description": "Reasoning subset included for audit."
                },
                "total": {
                  "type": "integer",
                  "minimum": 0,
                  "description": "Reported token total."
                }
              },
              "required": [
                "input",
                "cachedInput",
                "output",
                "reasoning",
                "total"
              ],
              "additionalProperties": true
            },
            "note": {
              "type": "string",
              "description": "Double-counting and provider-specific pricing note."
            }
          },
          "additionalProperties": true
        },
        "inputTokens": {
          "type": ["integer", "null"],
          "minimum": 0,
          "description": "Deduplicated run input tokens, or null when unavailable."
        },
        "outputTokens": {
          "type": ["integer", "null"],
          "minimum": 0,
          "description": "Deduplicated run output tokens, or null when unavailable."
        },
        "reasoningTokens": {
          "type": ["integer", "null"],
          "minimum": 0,
          "description": "Reasoning subset of output tokens, or null when unavailable."
        },
        "cacheInputTokens": {
          "type": ["integer", "null"],
          "minimum": 0,
          "description": "Cached subset of input tokens, or null when unavailable."
        },
        "totalTokens": {
          "type": ["integer", "null"],
          "minimum": 0,
          "description": "inputTokens + outputTokens, or null when unavailable."
        },
        "peakContext": {
          "type": "integer",
          "minimum": 0,
          "description": "Maximum single-request input/context size when available."
        },
        "durationSeconds": {
          "type": ["number", "null"],
          "minimum": 0,
          "description": "Measured run duration. Omit or null when unavailable."
        },
        "commands": {
          "type": "integer",
          "minimum": 0,
          "description": "Total normalized tool/command calls."
        },
        "rawArtifactStatus": {
          "type": "string",
          "description": "Short provenance note about source normalization."
        }
      },
      "required": [
        "model",
        "steps",
        "costUsd",
        "inputTokens",
        "outputTokens",
        "totalTokens"
      ],
      "additionalProperties": true
    },
    "run": {
      "type": "object",
      "description": "Execution identity and repository state.",
      "properties": {
        "status": { "$ref": "common.schema.json#/$defs/runStatus" },
        "agent": {
          "type": "string",
          "description": "Canonical base agent ID."
        },
        "provider": { "type": "string", "description": "Agent/CLI provider." },
        "runtimeModel": {
          "type": "string",
          "description": "Model observed from runtime metadata."
        },
        "model": {
          "type": "string",
          "description": "Model field used by the original run.v1 contract."
        },
        "mode": { "type": "string", "description": "Agent execution profile." },
        "startedAt": {
          "$ref": "common.schema.json#/$defs/timestamp",
          "description": "Run start time."
        },
        "completedAt": {
          "$ref": "common.schema.json#/$defs/timestamp",
          "description": "Run completion time."
        },
        "repository": {
          "type": "string",
          "description": "Source repository URL."
        },
        "branch": {
          "type": "string",
          "description": "Starting commit, branch, or ref."
        }
      },
      "required": ["status", "agent", "provider", "mode"],
      "anyOf": [{ "required": ["runtimeModel"] }, { "required": ["model"] }],
      "additionalProperties": true
    },
    "rounds": {
      "type": "array",
      "description": "Ordered display rounds. Complete messages and commands are preserved.",
      "items": { "$ref": "agent-round.schema.json" }
    },
    "harness": {
      "type": "array",
      "description": "Website-ready harness rows derived from harness-report.results.",
      "items": {
        "type": "object",
        "properties": {
          "id": { "type": "string", "description": "Harness rule/result ID." },
          "status": { "$ref": "common.schema.json#/$defs/runStatus" },
          "assertion": {
            "type": "string",
            "description": "Exact assertion or rule name displayed by the website."
          },
          "description": {
            "type": "string",
            "description": "Rule description."
          },
          "evidence": {
            "type": "string",
            "description": "Short evidence/category label."
          },
          "category": { "type": "string", "description": "Harness group." },
          "failure": { "$ref": "common.schema.json#/$defs/harnessFailure" },
          "harnessCodeLocation": {
            "$ref": "common.schema.json#/$defs/codeLocation"
          },
          "sourceLocation": { "$ref": "common.schema.json#/$defs/codeLocation" }
        },
        "required": ["id", "status", "assertion"],
        "additionalProperties": true
      }
    },
    "repoDiff": {
      "type": "array",
      "description": "Optional parsed diff rows. The current Repo tab uses the repo browser instead of relying on this array.",
      "items": { "type": "object", "additionalProperties": true }
    },
    "metadata": {
      "type": "object",
      "description": "Grouped metadata rendered as labeled fields rather than raw JSON.",
      "properties": {
        "common": {
          "type": ["object", "null"],
          "description": "Category, report, task, and run IDs common to all producers.",
          "additionalProperties": true
        },
        "agent": { "$ref": "common.schema.json#/$defs/agentMetadata" },
        "system": { "$ref": "common.schema.json#/$defs/systemMetadata" },
        "environment": {
          "$ref": "common.schema.json#/$defs/environmentMetadata"
        },
        "custom": {
          "type": "object",
          "description": "Producer-specific provenance. Custom fields are isolated here so common metadata remains stable.",
          "additionalProperties": true
        },
        "result_tab": { "type": "string", "description": "Category tab ID." },
        "result_tabs": {
          "type": "array",
          "description": "Available category descriptors; debug/rewrite do not create a separate Results tab.",
          "items": { "type": "object", "additionalProperties": true }
        },
        "contract_paths": {
          "type": "object",
          "description": "Relative links to normalized contract files.",
          "additionalProperties": { "type": "string" }
        }
      },
      "required": ["common", "agent", "system", "environment", "custom"],
      "additionalProperties": true
    }
  },
  "required": [
    "schema",
    "id",
    "task",
    "agent",
    "sessionName",
    "prompt",
    "source",
    "run",
    "rounds",
    "metadata"
  ],
  "additionalProperties": true
}
